<?xml version="1.0" encoding="UTF-8"?>
<!-- 
This sample dataset holds the complete information needed to set-up a visualization for the BO's ENE project. 
Author: Benno Schmidt, Department of Geodesy, Bochum University of Applied Sciences.
-->
<Dataset version="0.1" xsi:noNamespaceSchemaLocation="xsd/Dataset.xsd" xmlns:xsi="http://www.w3.org/2001/XMLSchema-instance">
	<GeneralInformation>
		<Theme>
			<Title language="EN">Tree Cover of India States in 2011</Title>
			<Title language="DE">Baumabdeckung der indischen States im Jahr 2011</Title>
			<Description language="DE">
				Die Datei enthält Informationen über die Baumabdeckung der indischen States im Jahr 2011.
			</Description>
		</Theme>
		<Unit/>
		<PublicReference>ENVIS Centre, Ministry of Environment and Forest, Govt. of India</PublicReference>
		<MetadataReference>IndiaTreeCover2011_meta.xml</MetadataReference>
	</GeneralInformation>
	<TableStructure>
		<Property dataType="String" uniqueID="true">
			<Title>States/UTs</Title>
			<Description>english name of the state</Description>
			<GeoReference featureType="ENE:StateName" externalGeometries="true">
				<CRS>ENE:CountryStates:name</CRS>
			</GeoReference>
		</Property>
		<Property dataType="Float">
			<Title>Area (GA)</Title>
			<Description/>
		</Property>
		<Property dataType="Float">
			<Title>Reserved Forests</Title>
			<Description/>
		</Property>
		<Property dataType="Float">
			<Title>Protected Forests</Title>
			<Description/>
		</Property>
<Property dataType="Float">
			<Title>Unclassified Forests</Title>
			<Description/>
		</Property>	
<Property dataType="Float">
			<Title>Total - RFA</Title>
			<Description/>
		</Property>			
		<Property dataType="Float">
			<Title>Tree Cover % of GA</Title>
			<Description/>
		</Property>
	</TableStructure>
	<Entries>
		<Entry>
			<Value>Andaman and Nicobar Islands</Value>
			<Value>8249.00</Value>
			<Value>5613.00</Value>
			<Value>1558.00</Value>
			<Value>0.00</Value>
			<Value>7171.00</Value>
			<Value>86.93</Value>
		</Entry>
		<Entry>
			<Value>Andhra Pradesh</Value>
			<Value>275069.00</Value>
			<Value>50479.00</Value>
			<Value>12365.00</Value>
			<Value>970.00</Value>
			<Value>63814.00</Value>
			<Value>23.20</Value>
		</Entry>
		<Entry>
			<Value>Arunachal Pradesh</Value>
			<Value>83743.00</Value>
			<Value>10723.00</Value>
			<Value>9779.00</Value>
			<Value>31039.00</Value>
			<Value>51541.00</Value>
			<Value>61.55</Value>
		</Entry>
		<Entry>
			<Value>Assam</Value>
			<Value>78438.00</Value>
			<Value>17864.00</Value>
			<Value>0.00</Value>
			<Value>8968.00</Value>
			<Value>26832.00</Value>
			<Value>34.21</Value>
		</Entry>
		<Entry>
			<Value>Bihar</Value>
			<Value>94163.00</Value>
			<Value>693.00</Value>
			<Value>5779.00</Value>
			<Value>1.00</Value>
			<Value>6473.00</Value>
			<Value>6.87</Value>
		</Entry>
		<Entry>
			<Value>Chandigarh</Value>
			<Value>114.00</Value>
			<Value>32.00</Value>
			<Value>0.00</Value>
			<Value>3.00</Value>
			<Value>35.00</Value>
			<Value>30.70</Value>
		</Entry>
		<Entry>
			<Value>Chhattisgarh</Value>
			<Value>135191.00</Value>
			<Value>25782.00</Value>
			<Value>24036.00</Value>
			<Value>9954.00</Value>
			<Value>59772.00</Value>
			<Value>44.21</Value>
		</Entry>
		<Entry>
			<Value>Dadra and NagarHaveli</Value>
			<Value>491.00</Value>
			<Value>199.00</Value>
			<Value>5.00</Value>
			<Value>0.00</Value>
			<Value>204.00</Value>
			<Value>41.55</Value>
		</Entry>
		<Entry>
			<Value>Daman and Diu</Value>
			<Value>112.00</Value>
			<Value>0.24</Value>
			<Value>0.00</Value>
			<Value>8.03</Value>
			<Value>8.00</Value>
			<Value>7.38</Value>
		</Entry>
		<Entry>
			<Value>Delhi</Value>
			<Value>1483.00</Value>
			<Value>78.00</Value>
			<Value>7.00</Value>
			<Value>0.00</Value>
			<Value>85.00</Value>
			<Value>5.73</Value>
		</Entry>
		<Entry>
			<Value>Goa</Value>
			<Value>3702.00</Value>
			<Value>253.00</Value>
			<Value>0.00</Value>
			<Value>972.00</Value>
			<Value>1225.00</Value>
			<Value>33.09</Value>
		</Entry>
		<Entry>
			<Value>Gujarat</Value>
			<Value>196022.00</Value>
			<Value>14373.00</Value>
			<Value>2886.00</Value>
			<Value>4388.00</Value>
			<Value>21647.00</Value>
			<Value>11.04</Value>
		</Entry>
		<Entry>
			<Value>Haryana</Value>
			<Value>44212.00</Value>
			<Value>249.00</Value>
			<Value>1158.00</Value>
			<Value>152.00</Value>
			<Value>1559.00</Value>
			<Value>3.53</Value>
		</Entry>
		<Entry>
			<Value>Himachal Pradesh</Value>
			<Value>55673.00</Value>
			<Value>1898.00</Value>
			<Value>33130.00</Value>
			<Value>2005.00</Value>
			<Value>37033.00</Value>
			<Value>66.52</Value>
		</Entry>
		<Entry>
			<Value>Jammu and Kashmir</Value>
			<Value>222236.00</Value>
			<Value>17643.00</Value>
			<Value>2551.00</Value>
			<Value>36.00</Value>
			<Value>20230.00</Value>
			<Value>9.10</Value>
		</Entry>
		<Entry>
			<Value>Jharkhand</Value>
			<Value>79714.00</Value>
			<Value>4387.00</Value>
			<Value>19185.00</Value>
			<Value>33.00</Value>
			<Value>23605.00</Value>
			<Value>29.61</Value>
		</Entry>
		<Entry>
			<Value>Karnataka</Value>
			<Value>191791.00</Value>
			<Value>28690.00</Value>
			<Value>3931.00</Value>
			<Value>5663.00</Value>
			<Value>38284.00</Value>
			<Value>19.96</Value>
		</Entry>
		<Entry>
			<Value>Kerala</Value>
			<Value>38863.00</Value>
			<Value>11309.00</Value>
			<Value>0.00</Value>
			<Value>0.00</Value>
			<Value>11309.00</Value>
			<Value>29.10</Value>
		</Entry>
		<Entry>
			<Value>Lakshadweep</Value>
			<Value>0.00</Value>
			<Value>0.00</Value>
			<Value>0.00</Value>
			<Value>0.00</Value>
			<Value>0.00</Value>
			<Value>0.00</Value>
		</Entry>
		<Entry>
			<Value>Madhya Pradesh</Value>
			<Value>308245.00</Value>
			<Value>61886.00</Value>
			<Value>31098.00</Value>
			<Value>1705.00</Value>
			<Value>94689.00</Value>
			<Value>30.72</Value>
		</Entry>
		<Entry>
			<Value>Maharashtra</Value>
			<Value>307713.00</Value>
			<Value>51548.00</Value>
			<Value>6727.00</Value>
			<Value>3082.00</Value>
			<Value>61357.00</Value>
			<Value>19.94</Value>
		</Entry>
		<Entry>
			<Value>Manipur</Value>
			<Value>22327.00</Value>
			<Value>1467.00</Value>
			<Value>4171.00</Value>
			<Value>11780.00</Value>
			<Value>17418.00</Value>
			<Value>78.01</Value>
		</Entry>
		<Entry>
			<Value>Meghalaya</Value>
			<Value>22429.00</Value>
			<Value>1113.00</Value>
			<Value>12.00</Value>
			<Value>8371.00</Value>
			<Value>9496.00</Value>
			<Value>42.34</Value>
		</Entry>
		<Entry>
			<Value>Mizoram</Value>
			<Value>21081.00</Value>
			<Value>7909.00</Value>
			<Value>3568.00</Value>
			<Value>5240.00</Value>
			<Value>16717.00</Value>
			<Value>79.30</Value>
		</Entry>
		<Entry>
			<Value>Nagaland</Value>
			<Value>16579.00</Value>
			<Value>86.00</Value>
			<Value>508.00</Value>
			<Value>8628.00</Value>
			<Value>9222.00</Value>
			<Value>55.62</Value>
		</Entry>
		<Entry>
			<Value>Odisha</Value>
			<Value>155707.00</Value>
			<Value>26329.00</Value>
			<Value>15525.00</Value>
			<Value>16282.00</Value>
			<Value>58136.00</Value>
			<Value>37.34</Value>
		</Entry>
		<Entry>
			<Value>Puducherry</Value>
			<Value>480.00</Value>
			<Value>0.00</Value>
			<Value>2.00</Value>
			<Value>11.00</Value>
			<Value>13.00</Value>
			<Value>2.71</Value>
		</Entry>
		<Entry>
			<Value>Punjab</Value>
			<Value>50362.00</Value>
			<Value>44.00</Value>
			<Value>1137.00</Value>
			<Value>1903.00</Value>
			<Value>3084.00</Value>
			<Value>6.12</Value>
		</Entry>
		<Entry>
			<Value>Rajasthan</Value>
			<Value>342239.00</Value>
			<Value>12475.00</Value>
			<Value>18217.00</Value>
			<Value>2045.00</Value>
			<Value>32737.00</Value>
			<Value>9.57</Value>
		</Entry>
		<Entry>
			<Value>Sikkim</Value>
			<Value>7096.00</Value>
			<Value>5452.00</Value>
			<Value>389.00</Value>
			<Value>0.00</Value>
			<Value>5841.00</Value>
			<Value>82.31</Value>
		</Entry>
		<Entry>
			<Value>Tamil Nadu</Value>
			<Value>130058.00</Value>
			<Value>19388.00</Value>
			<Value>2183.00</Value>
			<Value>1306.00</Value>
			<Value>22877.00</Value>
			<Value>17.59</Value>
		</Entry>
		<Entry>
			<Value>Total</Value>
			<Value>3287263.00</Value>
			<Value>425494.00</Value>
			<Value>214986.00</Value>
			<Value>131341.00</Value>
			<Value>771821.00</Value>
			<Value>23.48</Value>
		</Entry>
		<Entry>
			<Value>Tripura</Value>
			<Value>10486.00</Value>
			<Value>4175.00</Value>
			<Value>2.00</Value>
			<Value>2117.00</Value>
			<Value>6294.00</Value>
			<Value>60.02</Value>
		</Entry>
		<Entry>
			<Value>Uttar Pradesh</Value>
			<Value>240928.00</Value>
			<Value>11660.00</Value>
			<Value>1420.00</Value>
			<Value>3503.00</Value>
			<Value>16583.00</Value>
			<Value>6.88</Value>
		</Entry>
		<Entry>
			<Value>Uttarakhand</Value>
			<Value>53483.00</Value>
			<Value>24643.00</Value>
			<Value>9885.00</Value>
			<Value>123.00</Value>
			<Value>34651.00</Value>
			<Value>64.79</Value>
		</Entry>
		<Entry>
			<Value>West Bengal</Value>
			<Value>88752.00</Value>
			<Value>7054.00</Value>
			<Value>3772.00</Value>
			<Value>1053.00</Value>
			<Value>11879.00</Value>
			<Value>13.38</Value>
		</Entry>
	</Entries>
</Dataset>