<?xml version="1.0" encoding="UTF-8"?>
<!-- 
This sample dataset holds the complete information needed to set-up a visualization for the BO's ENE project. 

Author: Benno Schmidt, Department of Geodesy, Bochum University of Applied Sciences.

-->
<Dataset version="0.1" xsi:noNamespaceSchemaLocation="xsd/Dataset.xsd" xmlns:xsi="http://www.w3.org/2001/XMLSchema-instance">
	<GeneralInformation>
		<Theme>
			<Title>Nuclear accidents</Title>
			<Description>
			This dataset lists those places (not only nuclear power plants) where the most significant nuclear and radiation 
			accidents took place.
			</Description>
		</Theme>
		<Unit/>
		<PublicReference>Wikpedia 2014</PublicReference>
		<MetadataReference>NuclearAccidents_meta.xml</MetadataReference>
	</GeneralInformation>
	<TableStructure>
		<Property dataType="Integer">
			<Title>ID</Title>
			<Description/>
		</Property>
		<Property dataType="String">
			<Title>Longitude,Latitude</Title>
			<Description language="EN">Geographical longitude and latitude as comma-separated string</Description>
			<GeoReference featureType="ENE:Point" externalGeometries="false">
				<CRS>EPSG:4326</CRS>
			</GeoReference>
		</Property>
		<Property dataType="String">
			<Title>Place</Title>
			<Description>Place name in German language</Description>
		</Property>
		<Property dataType="Integer">
			<Title>Year</Title>
			<Description/>
		</Property>
		<Property dataType="Integer">
			<Title>INES scale level</Title>
			<Description/>
		</Property>
	</TableStructure>
	<Entries>
		<Entry>
			<Value>1</Value>
			<Value>-106.2975,35.8908333</Value>
			<Value>New Mexico</Value>
			<Value>1945</Value>
			<Value>4.00</Value>
		</Entry>
		<Entry>
			<Value>10</Value>
			<Value>-84.2502777777777,35.9663611111111</Value>
			<Value>Tennessee</Value>
			<Value>1959</Value>
			<Value>3.50</Value>
		</Entry>
		<Entry>
			<Value>11</Value>
			<Value>-112.057833333333,43.5169166666666</Value>
			<Value>Idaho</Value>
			<Value>1961</Value>
			<Value>4.00</Value>
		</Entry>
		<Entry>
			<Value>12</Value>
			<Value>-71.6666666666666,41.3666666666666</Value>
			<Value>Rhode Island</Value>
			<Value>1964</Value>
			<Value>4.00</Value>
		</Entry>
		<Entry>
			<Value>13</Value>
			<Value>61.3166666666666,56.85</Value>
			<Value>Belojarsk</Value>
			<Value>1964</Value>
			<Value>4.00</Value>
		</Entry>
		<Entry>
			<Value>14</Value>
			<Value>61.3166666666666,56.85</Value>
			<Value>Belojarsk</Value>
			<Value>1965</Value>
			<Value>4.00</Value>
		</Entry>
		<Entry>
			<Value>15</Value>
			<Value>61.3166666666666,56.85</Value>
			<Value>Belojarsk</Value>
			<Value>1966</Value>
			<Value>4.00</Value>
		</Entry>
		<Entry>
			<Value>16</Value>
			<Value>61.3166666666666,56.85</Value>
			<Value>Belojarsk</Value>
			<Value>1967</Value>
			<Value>4.00</Value>
		</Entry>
		<Entry>
			<Value>17</Value>
			<Value>61.3166666666666,56.85</Value>
			<Value>Belojarsk</Value>
			<Value>1968</Value>
			<Value>4.00</Value>
		</Entry>
		<Entry>
			<Value>18</Value>
			<Value>61.3166666666666,56.85</Value>
			<Value>Belojarsk</Value>
			<Value>1969</Value>
			<Value>4.00</Value>
		</Entry>
		<Entry>
			<Value>19</Value>
			<Value>61.3166666666666,56.85</Value>
			<Value>Belojarsk</Value>
			<Value>1970</Value>
			<Value>4.00</Value>
		</Entry>
		<Entry>
			<Value>2</Value>
			<Value>-106.2975,35.8908333</Value>
			<Value>New Mexico</Value>
			<Value>1946</Value>
			<Value>4.00</Value>
		</Entry>
		<Entry>
			<Value>20</Value>
			<Value>61.3166666666666,56.85</Value>
			<Value>Belojarsk</Value>
			<Value>1971</Value>
			<Value>4.00</Value>
		</Entry>
		<Entry>
			<Value>21</Value>
			<Value>61.3166666666666,56.85</Value>
			<Value>Belojarsk</Value>
			<Value>1972</Value>
			<Value>4.00</Value>
		</Entry>
		<Entry>
			<Value>22</Value>
			<Value>61.3166666666666,56.85</Value>
			<Value>Belojarsk</Value>
			<Value>1973</Value>
			<Value>4.00</Value>
		</Entry>
		<Entry>
			<Value>23</Value>
			<Value>61.3166666666666,56.85</Value>
			<Value>Belojarsk</Value>
			<Value>1974</Value>
			<Value>4.00</Value>
		</Entry>
		<Entry>
			<Value>24</Value>
			<Value>61.3166666666666,56.85</Value>
			<Value>Belojarsk</Value>
			<Value>1975</Value>
			<Value>4.00</Value>
		</Entry>
		<Entry>
			<Value>25</Value>
			<Value>61.3166666666666,56.85</Value>
			<Value>Belojarsk</Value>
			<Value>1976</Value>
			<Value>4.00</Value>
		</Entry>
		<Entry>
			<Value>26</Value>
			<Value>61.3166666666666,56.85</Value>
			<Value>Belojarsk</Value>
			<Value>1977</Value>
			<Value>4.00</Value>
		</Entry>
		<Entry>
			<Value>27</Value>
			<Value>61.3166666666666,56.85</Value>
			<Value>Belojarsk</Value>
			<Value>1978</Value>
			<Value>4.00</Value>
		</Entry>
		<Entry>
			<Value>28</Value>
			<Value>61.3166666666666,56.85</Value>
			<Value>Belojarsk</Value>
			<Value>1979</Value>
			<Value>4.00</Value>
		</Entry>
		<Entry>
			<Value>29</Value>
			<Value>36.5740555555555,55.0853055555555</Value>
			<Value>Melekess</Value>
			<Value>1966</Value>
			<Value>3.50</Value>
		</Entry>
		<Entry>
			<Value>3</Value>
			<Value>-119.468694444444,46.5296944444444</Value>
			<Value>Washington</Value>
			<Value>1949</Value>
			<Value>4.00</Value>
		</Entry>
		<Entry>
			<Value>30</Value>
			<Value>-83.2588055555555,41.9638611111111</Value>
			<Value>Michigan</Value>
			<Value>1966</Value>
			<Value>4.00</Value>
		</Entry>
		<Entry>
			<Value>31</Value>
			<Value>6.83888333333333,46.7080611111111</Value>
			<Value>Lucens</Value>
			<Value>1969</Value>
			<Value>4.50</Value>
		</Entry>
		<Entry>
			<Value>32</Value>
			<Value>-105.232277777777,39.8929722222222</Value>
			<Value>Colorado</Value>
			<Value>1969</Value>
			<Value>4.50</Value>
		</Entry>
		<Entry>
			<Value>33</Value>
			<Value>-3.4975,54.4186111111111</Value>
			<Value>Sellafield</Value>
			<Value>1973</Value>
			<Value>4.00</Value>
		</Entry>
		<Entry>
			<Value>34</Value>
			<Value>30.0511944444444,59.8521111111111</Value>
			<Value>Leningrad</Value>
			<Value>1974</Value>
			<Value>4.50</Value>
		</Entry>
		<Entry>
			<Value>35</Value>
			<Value>30.0511944444444,59.8521111111111</Value>
			<Value>Leningrad</Value>
			<Value>1975</Value>
			<Value>4.50</Value>
		</Entry>
		<Entry>
			<Value>36</Value>
			<Value>61.3166666666666,56.85</Value>
			<Value>Belojarsk</Value>
			<Value>1977</Value>
			<Value>5.00</Value>
		</Entry>
		<Entry>
			<Value>37</Value>
			<Value>17.6805555555555,48.4944444444444</Value>
			<Value>Jaslovsk√© Bohunice</Value>
			<Value>1977</Value>
			<Value>4.00</Value>
		</Entry>
		<Entry>
			<Value>38</Value>
			<Value>61.3166666666666,56.85</Value>
			<Value>Belojarsk</Value>
			<Value>1978</Value>
			<Value>3.50</Value>
		</Entry>
		<Entry>
			<Value>39</Value>
			<Value>-76.725,40.1547222222222</Value>
			<Value>Pennsylvania</Value>
			<Value>1979</Value>
			<Value>5.00</Value>
		</Entry>
		<Entry>
			<Value>4</Value>
			<Value>-77.4486666666666,46.0185555555555</Value>
			<Value>Chalk River</Value>
			<Value>1952</Value>
			<Value>5.00</Value>
		</Entry>
		<Entry>
			<Value>40</Value>
			<Value>4.57861111111111,47.7205555555555</Value>
			<Value>Saint-Laurent</Value>
			<Value>1980</Value>
			<Value>4.00</Value>
		</Entry>
		<Entry>
			<Value>41</Value>
			<Value>30.0996944444444,51.3897777777777</Value>
			<Value>Tschernobyl</Value>
			<Value>1982</Value>
			<Value>5.00</Value>
		</Entry>
		<Entry>
			<Value>42</Value>
			<Value>-59.1863888888888,-33.9633333333333</Value>
			<Value>Buenos Aires</Value>
			<Value>1983</Value>
			<Value>4.00</Value>
		</Entry>
		<Entry>
			<Value>43</Value>
			<Value>131.9,43.1166666666666</Value>
			<Value>Wladiwostok</Value>
			<Value>1985</Value>
			<Value>5.00</Value>
		</Entry>
		<Entry>
			<Value>44</Value>
			<Value>-95.1318055555555,35.5470277777777</Value>
			<Value>Oklahoma</Value>
			<Value>1986</Value>
			<Value>3.00</Value>
		</Entry>
		<Entry>
			<Value>45</Value>
			<Value>30.0996944444444,51.3897777777777</Value>
			<Value>Tschernobyl</Value>
			<Value>1986</Value>
			<Value>7.00</Value>
		</Entry>
		<Entry>
			<Value>46</Value>
			<Value>84.85,56.6</Value>
			<Value>Sewersk</Value>
			<Value>1993</Value>
			<Value>3.00</Value>
		</Entry>
		<Entry>
			<Value>47</Value>
			<Value>140.606666666666,36.4663888888888</Value>
			<Value>T?kai-mura</Value>
			<Value>1999</Value>
			<Value>3.00</Value>
		</Entry>
		<Entry>
			<Value>48</Value>
			<Value>4.55,50.4666666666666</Value>
			<Value>Fleurus</Value>
			<Value>2006</Value>
			<Value>4.50</Value>
		</Entry>
		<Entry>
			<Value>49</Value>
			<Value>141.0325,37.4166666666666</Value>
			<Value>Fukushima</Value>
			<Value>2011</Value>
			<Value>7.00</Value>
		</Entry>
		<Entry>
			<Value>5</Value>
			<Value>-112.057833333333,43.5169166666666</Value>
			<Value>Idaho</Value>
			<Value>1955</Value>
			<Value>4.00</Value>
		</Entry>
		<Entry>
			<Value>6</Value>
			<Value>22.0184722222222,54.4087777777777</Value>
			<Value>Kyschtym</Value>
			<Value>1957</Value>
			<Value>6.00</Value>
		</Entry>
		<Entry>
			<Value>7</Value>
			<Value>-3.4975,54.4186111111111</Value>
			<Value>Sellafield</Value>
			<Value>1957</Value>
			<Value>5.00</Value>
		</Entry>
		<Entry>
			<Value>8</Value>
			<Value>-106.2975,35.8908333333333</Value>
			<Value>New Mexico</Value>
			<Value>1958</Value>
			<Value>4.00</Value>
		</Entry>
		<Entry>
			<Value>9</Value>
			<Value>-118.774055555555,34.2400555555555</Value>
			<Value>Kalifornien</Value>
			<Value>1959</Value>
			<Value>5.50</Value>
		</Entry>
	</Entries>
</Dataset>
