<?xml version="1.0" encoding="UTF-8"?>
<!-- 
This sample dataset holds the complete information needed to set-up a visualization for the BO's ENE project. 
Author: Benno Schmidt, Department of Geodesy, Bochum University of Applied Sciences.
-->
<Dataset version="0.1" xmlns:xsi="http://www.w3.org/2001/XMLSchema-instance" xsi:noNamespaceSchemaLocation="xsd/Dataset.xsd">
	<GeneralInformation>
		<Theme>
			<Title language="EN">Nocturnal lighting situation</Title>
			<Title language="DE">Naechtliche Beleuchtungsituation der Erde</Title>
			<Description>
			This dataset illustrates the nocturnal lighting-situation. This global view of Earth's city lights is a composite 
			assembled from data acquired by the Suomi NPP satellite. The data was acquired over nine days in April 2012 
			and 13 days in October 2012. It took 312 orbits to get a clear shot of every parcel of Earth's land surface and islands. 
			This new data was then mapped over existing Blue Marble imagery of Earth to provide a realistic view of the planet.
			</Description>
		</Theme>
		<Unit />
		<PublicReference>NASA Earth Observatory/NOAA NGDC 2012</PublicReference>
		<MetadataReference>EarthAtNight_meta.xml</MetadataReference>
	</GeneralInformation>
	<TableStructure>
		<Property dataType="">
			<Title>Spatial extent</Title>
			<Description />
			<GeoReference featureType="ENE:Bitmap" externalGeometries="false">
				<CRS>EPSG:4326</CRS>
			</GeoReference>
		</Property>
		<Property dataType="String">
			<Title>File name</Title>
		</Property>
		<Property dataType="String">
			<Title>Image size</Title>
			<Description>Image size in pixels</Description>
		</Property>
	</TableStructure>
	<Entries>
		<Entry>
			<Value>-180,-90,180,90</Value>
			<Value>EarthAtNight.jpg</Value>
			<Value>3600x1800</Value>
		</Entry>
	</Entries>
</Dataset>
