<?xml version="1.0" encoding="UTF-8"?>
<!-- 
This sample dataset holds the complete information needed to set-up a visualization for the BO's ENE project. 
Authors: Christian Danowski, Benno Schmidt, Department of Geodesy, Bochum University of Applied Sciences.
-->
<Dataset version="0.1" xsi:noNamespaceSchemaLocation="xsd/Dataset.xsd" xmlns:xsi="http://www.w3.org/2001/XMLSchema-instance">
	<GeneralInformation>
		<Theme>
			<Title language="EN">Electricity Consumption</Title><!-- Titel bezogen auf die Sprache: Englisch-->
			<Title language="DE">Stromverbrauch</Title><!-- Titel bezogen auf die Sprache: Deutsch-->
			<Description language="EN">This dataset gives the electricity comsumption for the years 2000, 2005-2009 in terrawatts per hours for the World's countries.</Description><!-- Erklärung auf Englisch-->
			<Description language="DE">Dieser Datensatz enthält staatenweise den Stromverbrauch in Terawattstunden für die Jahre 2000, 2005-2009.</Description><!-- Erklärung auf Deutsch-->
		</Theme>
		<Unit>
			<Title>Terawatt hours per year</Title><!-- Einheiten auf welche sich die gegebenen Daten beziehen: Englisch-->
			<Code>TWh/a</Code><!-- Einheiten Kodiert-->
		</Unit>
		<PublicReference>Wikipedia</PublicReference>
		<MetadataReference>ElectricityConsumption_meta.xml</MetadataReference><!-- Referenz der Metadatendatei-->
	</GeneralInformation>
	<TableStructure>
		<Property dataType="ENE:iso3166-2" uniqueID="true"><!-- Hier verwendete Kodierliste bezüglich der Länderkürzel-->
			<Title>Country code</Title><!-- Titel-->
			<Description>Country code ISO 3166-2</Description><!-- For geo-referenced 
properties, a GeoReference element should be present: -->
			<GeoReference featureType="ENE:CountryCode" externalGeometries="true">
				<CRS>ENE:CountriesWorldwide:iso3166-2</CRS>
			</GeoReference>
		</Property>
		<Property dataType="Float">
			<Title>2000</Title><!-- For time-referenced 
properties, a TimeReference element should be present: -->
			<TimeReference>
				<begin>2000-01-01+01:00</begin>
				<end>2000-12-31+01:00</end>
			</TimeReference>
			<Description/>
		</Property>
		<Property dataType="Float">
			<Title>2005</Title>
			<TimeReference>
				<begin>2005-01-01+01:00</begin>
				<end>2005-12-31+01:00</end>
			</TimeReference>
			<Description/>
		</Property>
		<Property dataType="Float">
			<Title>2006</Title>
			<TimeReference>
				<begin>2006-01-01+01:00</begin>
				<end>2006-12-31+01:00</end>
			</TimeReference>
			<Description/>
		</Property>
		<Property dataType="Float">
			<Title>2007</Title>
			<TimeReference>
				<begin>2007-01-01+01:00</begin>
				<end>2007-12-31+01:00</end>
			</TimeReference>
			<Description/>
		</Property>
		<Property dataType="Float">
			<Title>2008</Title>
			<TimeReference>
				<begin>2008-01-01+01:00</begin>
				<end>2008-12-31+01:00</end>
			</TimeReference>
			<Description/>
		</Property>
		<Property dataType="Float">
			<Title>2009</Title>
			<TimeReference>
				<begin>2009-01-01+01:00</begin>
				<end>2009-12-31+01:00</end>
			</TimeReference>
			<Description/>
		</Property>
	</TableStructure>
	<Entries>
		<Entry>
			<Value>AU</Value>
			<Value>182.9</Value>
			<Value>212.4</Value>
			<Value>214.2</Value>
			<Value>220.2</Value>
			<Value>225.3</Value>
			<Value>228.8</Value>
		</Entry>
		<Entry>
			<Value>BR</Value>
			<Value>321.6</Value>
			<Value>368.8</Value>
			<Value>383.2</Value>
			<Value>405.1</Value>
			<Value>420.0</Value>
			<Value>418.0</Value>
		</Entry>
		<Entry>
			<Value>CA</Value>
			<Value>504.8</Value>
			<Value>541.3</Value>
			<Value>528.7</Value>
			<Value>536.0</Value>
			<Value>528.5</Value>
			<Value>504.8</Value>
		</Entry>
		<Entry>
			<Value>CN</Value>
			<Value>1177.9</Value>
			<Value>2195.1</Value>
			<Value>2528.9</Value>
			<Value>2833.2</Value>
			<Value>3018.2</Value>
			<Value>3253.2</Value>
		</Entry>
		<Entry>
			<Value>DE</Value>
			<Value>503.2</Value>
			<Value>543.4</Value>
			<Value>547.4</Value>
			<Value>547.3</Value>
			<Value>544.5</Value>
			<Value>509.5</Value>
		</Entry>
		<Entry>
			<Value>ES</Value>
			<Value>193.6</Value>
			<Value>244.4</Value>
			<Value>261.0</Value>
			<Value>263.8</Value>
			<Value>270.7</Value>
			<Value>256.6</Value>
		</Entry>
		<Entry>
			<Value>FR</Value>
			<Value>409.8</Value>
			<Value>449.9</Value>
			<Value>445.2</Value>
			<Value>447.2</Value>
			<Value>460.2</Value>
			<Value>451.4</Value>
		</Entry>
		<Entry>
			<Value>GB</Value>
			<Value>335.4</Value>
			<Value>352.5</Value>
			<Value>349.9</Value>
			<Value>347.6</Value>
			<Value>344.3</Value>
			<Value>325.8</Value>
		</Entry>
		<Entry>
			<Value>IN</Value>
			<Value>375.4</Value>
			<Value>483.3</Value>
			<Value>531.5</Value>
			<Value>590.6</Value>
			<Value>626.5</Value>
			<Value>637.6</Value>
		</Entry>
		<Entry>
			<Value>IR</Value>
			<Value>92.9</Value>
			<Value>135.4</Value>
			<Value>148.8</Value>
			<Value>156.6</Value>
			<Value>166.2</Value>
			<Value>173.1</Value>
		</Entry>
		<Entry>
			<Value>IT</Value>
			<Value>278.7</Value>
			<Value>307.1</Value>
			<Value>314.0</Value>
			<Value>314.9</Value>
			<Value>314.6</Value>
			<Value>296.3</Value>
		</Entry>
		<Entry>
			<Value>JP</Value>
			<Value>940.7</Value>
			<Value>977.7</Value>
			<Value>983.9</Value>
			<Value>1009.0</Value>
			<Value>966.4</Value>
			<Value>934.3</Value>
		</Entry>
		<Entry>
			<Value>KR</Value>
			<Value>236.2</Value>
			<Value>352.3</Value>
			<Value>364.9</Value>
			<Value>386.2</Value>
			<Value>402.0</Value>
			<Value>408.5</Value>
		</Entry>
		<Entry>
			<Value>MX</Value>
			<Value>159.9</Value>
			<Value>192.2</Value>
			<Value>196.4</Value>
			<Value>202.1</Value>
			<Value>206.1</Value>
			<Value>203.7</Value>
		</Entry>
		<Entry>
			<Value>RU</Value>
			<Value>715.5</Value>
			<Value>776.8</Value>
			<Value>816.0</Value>
			<Value>844.4</Value>
			<Value>857.6</Value>
			<Value>808.0</Value>
		</Entry>
		<Entry>
			<Value>SA</Value>
			<Value>109.5</Value>
			<Value>147.0</Value>
			<Value>156.8</Value>
			<Value>163.4</Value>
			<Value>174.2</Value>
			<Value>186.1</Value>
		</Entry>
		<Entry>
			<Value>TR</Value>
			<Value>98.6</Value>
			<Value>129.0</Value>
			<Value>141.5</Value>
			<Value>153.7</Value>
			<Value>160.4</Value>
			<Value>155.2</Value>
		</Entry>
		<Entry>
			<Value>TW</Value>
			<Value>163.4</Value>
			<Value>199.7</Value>
			<Value>205.5</Value>
			<Value>215.3</Value>
			<Value>212.7</Value>
			<Value>203.8</Value>
		</Entry>
		<Entry>
			<Value>US</Value>
			<Value>3592.4</Value>
			<Value>3811.0</Value>
			<Value>3816.8</Value>
			<Value>3890.2</Value>
			<Value>3865.2</Value>
			<Value>3723.8</Value>
		</Entry>
		<Entry>
			<Value>ZA</Value>
			<Value>180.1</Value>
			<Value>205.0</Value>
			<Value>210.6</Value>
			<Value>219.6</Value>
			<Value>212.2</Value>
			<Value>206.1</Value>
		</Entry>
	</Entries>
</Dataset>
