<?xml version="1.0" encoding="UTF-8"?>
<!-- 
This sample dataset holds the complete information needed to set-up a visualization for the BO's ENE project. 
Authors: Christian Danowski, Benno Schmidt, Department of Geodesy, Bochum University of Applied Sciences.
-->
<Dataset version="0.1" xsi:noNamespaceSchemaLocation="xsd/Dataset.xsd" xmlns:xsi="http://www.w3.org/2001/XMLSchema-instance">
	<GeneralInformation>
		<Theme>
			<Title language="EN">Electricity Import</Title><!-- Titel bezogen auf die Sprache: Englisch-->
			<Title language="DE">Stromimport</Title><!-- Titel bezogen auf die Sprache: Deutsch-->
			<Description language="EN">This dataset gives the electricity import for the years 2000, 2005-2010 in terrawatts per hours for the World's countries.</Description><!-- Erklärung auf Englisch-->
			<Description language="DE">Dieser Datensatz enthält staatenweise den Stromimport in Terawattstunden für die Jahre 2000, 2005-2010.</Description><!-- Erklärung auf Deutsch-->
		</Theme>
		<Unit>
			<Title>Terawatt hours per year</Title><!-- Einheiten auf welche sich die gegebenen Daten beziehen: Englisch-->
			<Code>TWh/a</Code><!-- Einheiten Kodiert-->
		</Unit>
		<PublicReference>Wikipedia</PublicReference>
		<MetadataReference>ElectricityImport_meta.xml</MetadataReference><!-- Referenz der Metadatendatei-->
	</GeneralInformation>
	<TableStructure>
		<Property dataType="ENE:iso3166-2" uniqueID="true"><!-- Hier verwendete Kodierliste bezüglich der Länderkürzel-->
			<Title>Country code</Title><!-- Titel-->
			<Description>Country code ISO 3166-2</Description><!-- For geo-referenced 
properties, a GeoReference element should be present: -->
			<GeoReference featureType="ENE:CountryCode" externalGeometries="true">
				<CRS>ENE:CountriesWorldwide:iso3166-2</CRS>
			</GeoReference>
		</Property>
		<Property dataType="Float">
			<Title>2000</Title><!-- For time-referenced 
properties, a TimeReference element should be present: -->
			<TimeReference>
				<begin>2000-01-01+01:00</begin>
				<end>2000-12-31+01:00</end>
			</TimeReference>
			<Description/>
		</Property>
		<Property dataType="Float">
			<Title>2005</Title>
			<TimeReference>
				<begin>2005-01-01+01:00</begin>
				<end>2005-12-31+01:00</end>
			</TimeReference>
			<Description/>
		</Property>
		<Property dataType="Float">
			<Title>2006</Title>
			<TimeReference>
				<begin>2006-01-01+01:00</begin>
				<end>2006-12-31+01:00</end>
			</TimeReference>
			<Description/>
		</Property>
		<Property dataType="Float">
			<Title>2007</Title>
			<TimeReference>
				<begin>2007-01-01+01:00</begin>
				<end>2007-12-31+01:00</end>
			</TimeReference>
			<Description/>
		</Property>
		<Property dataType="Float">
			<Title>2008</Title>
			<TimeReference>
				<begin>2008-01-01+01:00</begin>
				<end>2008-12-31+01:00</end>
			</TimeReference>
			<Description/>
		</Property>
		<Property dataType="Float">
			<Title>2009</Title>
			<TimeReference>
				<begin>2009-01-01+01:00</begin>
				<end>2009-12-31+01:00</end>
			</TimeReference>
			<Description/>
		</Property>
		<Property dataType="Float">
			<Title>2010</Title>
			<TimeReference>
				<begin>2010-01-01+01:00</begin>
				<end>2010-12-31+01:00</end>
			</TimeReference>
			<Description/>
		</Property>
	</TableStructure>
	<Entries>
		<Entry>
			<Value>AR</Value>
			<Value>7.25</Value>
			<Value>8.02</Value>
			<Value>7.42</Value>
			<Value>10.28</Value>
			<Value>8.46</Value>
			<Value>8.60</Value>
			<Value>10.30</Value>
		</Entry>
		<Entry>
			<Value>AT</Value>
			<Value>13.82</Value>
			<Value>20.40</Value>
			<Value>21.26</Value>
			<Value>22.13</Value>
			<Value>19.80</Value>
			<Value>19.54</Value>
			<Value>19.75</Value>
		</Entry>
		<Entry>
			<Value>BE</Value>
			<Value>11.65</Value>
			<Value>14.33</Value>
			<Value>18.85</Value>
			<Value>15.82</Value>
			<Value>17.16</Value>
			<Value>9.49</Value>
			<Value>12.41</Value>
		</Entry>
		<Entry>
			<Value>BR</Value>
			<Value>43.00</Value>
			<Value>39.20</Value>
			<Value>41.45</Value>
			<Value>40.87</Value>
			<Value>42.90</Value>
			<Value>40.75</Value>
			<Value>36.63</Value>
		</Entry>
		<Entry>
			<Value>CA</Value>
			<Value>12.69</Value>
			<Value>19.32</Value>
			<Value>23.41</Value>
			<Value>19.56</Value>
			<Value>23.61</Value>
			<Value>17.52</Value>
			<Value>18.79</Value>
		</Entry>
		<Entry>
			<Value>CH</Value>
			<Value>24.33</Value>
			<Value>38.35</Value>
			<Value>33.80</Value>
			<Value>34.82</Value>
			<Value>31.60</Value>
			<Value>31.37</Value>
			<Value>33.40</Value>
		</Entry>
		<Entry>
			<Value>DE</Value>
			<Value>45.13</Value>
			<Value>56.86</Value>
			<Value>48.46</Value>
			<Value>45.95</Value>
			<Value>41.67</Value>
			<Value>41.86</Value>
			<Value>42.96</Value>
		</Entry>
		<Entry>
			<Value>DK</Value>
			<Value>8.42</Value>
			<Value>12.94</Value>
			<Value>6.77</Value>
			<Value>10.43</Value>
			<Value>12.82</Value>
			<Value>11.21</Value>
			<Value>10.60</Value>
		</Entry>
		<Entry>
			<Value>FI</Value>
			<Value>12.21</Value>
			<Value>17.95</Value>
			<Value>14.12</Value>
			<Value>15.42</Value>
			<Value>16.11</Value>
			<Value>15.46</Value>
			<Value>15.72</Value>
		</Entry>
		<Entry>
			<Value>GR</Value>
			<Value>1.73</Value>
			<Value>5.62</Value>
			<Value>6.14</Value>
			<Value>6.41</Value>
			<Value>7.58</Value>
			<Value>7.60</Value>
			<Value>8.52</Value>
		</Entry>
		<Entry>
			<Value>HK</Value>
			<Value>10.20</Value>
			<Value>11.00</Value>
			<Value>10.90</Value>
			<Value>10.96</Value>
			<Value>11.30</Value>
			<Value>11.59</Value>
			<Value>11.05</Value>
		</Entry>
		<Entry>
			<Value>HU</Value>
			<Value>9.52</Value>
			<Value>15.64</Value>
			<Value>15.39</Value>
			<Value>14.68</Value>
			<Value>12.77</Value>
			<Value>10.97</Value>
			<Value>9.90</Value>
		</Entry>
		<Entry>
			<Value>IN</Value>
			<Value>1.54</Value>
			<Value>1.76</Value>
			<Value>2.96</Value>
			<Value>5.23</Value>
			<Value>9.25</Value>
			<Value>10.53</Value>
			<Value>11.00</Value>
		</Entry>
		<Entry>
			<Value>IT</Value>
			<Value>44.83</Value>
			<Value>50.26</Value>
			<Value>46.60</Value>
			<Value>48.93</Value>
			<Value>43.43</Value>
			<Value>46.57</Value>
			<Value>45.76</Value>
		</Entry>
		<Entry>
			<Value>NL</Value>
			<Value>22.95</Value>
			<Value>23.69</Value>
			<Value>27.35</Value>
			<Value>23.14</Value>
			<Value>24.97</Value>
			<Value>15.45</Value>
			<Value>15.58</Value>
		</Entry>
		<Entry>
			<Value>NO</Value>
			<Value>1.47</Value>
			<Value>3.65</Value>
			<Value>9.80</Value>
			<Value>5.29</Value>
			<Value>3.41</Value>
			<Value>5.65</Value>
			<Value>14.67</Value>
		</Entry>
		<Entry>
			<Value>SE</Value>
			<Value>18.31</Value>
			<Value>14.58</Value>
			<Value>17.54</Value>
			<Value>16.05</Value>
			<Value>12.75</Value>
			<Value>13.77</Value>
			<Value>14.93</Value>
		</Entry>
		<Entry>
			<Value>US</Value>
			<Value>48.59</Value>
			<Value>44.53</Value>
			<Value>42.69</Value>
			<Value>51.40</Value>
			<Value>57.02</Value>
			<Value>52.19</Value>
			<Value>45.23</Value>
		</Entry>
		<Entry>
			<Value>UZ</Value>
			<Value>14.03</Value>
			<Value>11.42</Value>
			<Value>11.82</Value>
			<Value>11.36</Value>
			<Value>11.46</Value>
			<Value>11.58</Value>
			<Value>11.60</Value>
		</Entry>
		<Entry>
			<Value>ZA</Value>
			<Value>5.29</Value>
			<Value>11.08</Value>
			<Value>10.62</Value>
			<Value>11.35</Value>
			<Value>10.57</Value>
			<Value>12.30</Value>
			<Value>12.19</Value>
		</Entry>
	</Entries>
</Dataset>
