<?xml version="1.0" encoding="UTF-8"?>
<!-- 
This sample dataset holds the complete information needed to set-up a visualization for the BO's ENE project. 
Authors: Christian Danowski, Benno Schmidt, Department of Geodesy, Bochum University of Applied Sciences.
-->
<Dataset version="0.1" xsi:noNamespaceSchemaLocation="xsd/Dataset.xsd" xmlns:xsi="http://www.w3.org/2001/XMLSchema-instance">
	<GeneralInformation>
		<Theme>
			<Title language="EN">Electricity Export</Title><!-- Titel bezogen auf die Sprache: Englisch-->
			<Title language="DE">Stromexport</Title><!-- Titel bezogen auf die Sprache: Deutsch-->
			<Description language="EN">This dataset gives the electricity export for the years 2000, 2005-2010 in terrawatts per hours for the World's countries.</Description><!-- Erklaerung auf Englisch-->
			<Description language="DE">Dieser Datensatz enthaelt staatenweise den Stromexport in Terawattstunden fuer die Jahre 2000, 2005-2010.</Description><!-- Erklaerung auf Deutsch-->
		</Theme>
		<Unit>
			<Title>Terawatt hours per year</Title><!-- Einheiten auf welche sich die gegebenen Daten beziehen: Englisch-->
			<Code>TWh/a</Code><!-- Einheiten Kodiert-->
		</Unit>
		<PublicReference>Wikipedia</PublicReference>
		<MetadataReference>ElectricityExport_meta.xml</MetadataReference><!-- Referenz der Metadatendatei-->
	</GeneralInformation>
	<TableStructure>
		<Property dataType="ENE:iso3166-2" uniqueID="true"><!-- Hier verwendete Kodierliste bezueglich der Laenderkuerzel-->
			<Title>Country code</Title><!-- Titel-->
			<Description>Country code ISO 3166-2</Description><!-- For geo-referenced 
properties, a GeoReference element should be present: -->
			<GeoReference featureType="ENE:CountryCode" externalGeometries="true">
				<CRS>ENE:CountriesWorldwide:iso3166-2</CRS>
			</GeoReference>
		</Property>
		<Property dataType="Float">
			<Title>2000</Title><!-- For time-referenced 
properties, a TimeReference element should be present: -->
			<TimeReference>
				<begin>2000-01-01+01:00</begin>
				<end>2000-12-31+01:00</end>
			</TimeReference>
			<Description/>
		</Property>
		<Property dataType="Float">
			<Title>2005</Title>
			<TimeReference>
				<begin>2005-01-01+01:00</begin>
				<end>2005-12-31+01:00</end>
			</TimeReference>
			<Description/>
		</Property>
		<Property dataType="Float">
			<Title>2006</Title>
			<TimeReference>
				<begin>2006-01-01+01:00</begin>
				<end>2006-12-31+01:00</end>
			</TimeReference>
			<Description/>
		</Property>
		<Property dataType="Float">
			<Title>2007</Title>
			<TimeReference>
				<begin>2007-01-01+01:00</begin>
				<end>2007-12-31+01:00</end>
			</TimeReference>
			<Description/>
		</Property>
		<Property dataType="Float">
			<Title>2008</Title>
			<TimeReference>
				<begin>2008-01-01+01:00</begin>
				<end>2008-12-31+01:00</end>
			</TimeReference>
			<Description/>
		</Property>
		<Property dataType="Float">
			<Title>2009</Title>
			<TimeReference>
				<begin>2009-01-01+01:00</begin>
				<end>2009-12-31+01:00</end>
			</TimeReference>
			<Description/>
		</Property>
		<Property dataType="Float">
			<Title>2010</Title>
			<TimeReference>
				<begin>2010-01-01+01:00</begin>
				<end>2010-12-31+01:00</end>
			</TimeReference>
			<Description/>
		</Property>
	</TableStructure>
	<Entries>
		<Entry>
			<Value>AT</Value>
			<Value>15.19</Value>
			<Value>17.73</Value>
			<Value>14.41</Value>
			<Value>15.51</Value>
			<Value>14.93</Value>
			<Value>18.76</Value>
			<Value>17.53</Value>
		</Entry>
		<Entry>
			<Value>BE</Value>
			<Value>7.32</Value>
			<Value>8.02</Value>
			<Value>8.70</Value>
			<Value>9.04</Value>
			<Value>6.56</Value>
			<Value>11.32</Value>
			<Value>11.84</Value>
		</Entry>
		<Entry>
			<Value>BG</Value>
			<Value>5.58</Value>
			<Value>8.38</Value>
			<Value>8.88</Value>
			<Value>7.53</Value>
			<Value>8.44</Value>
			<Value>7.74</Value>
			<Value>9.36</Value>
		</Entry>
		<Entry>
			<Value>CA</Value>
			<Value>48.52</Value>
			<Value>42.93</Value>
			<Value>41.54</Value>
			<Value>50.12</Value>
			<Value>55.73</Value>
			<Value>50.87</Value>
			<Value>43.91</Value>
		</Entry>
		<Entry>
			<Value>CH</Value>
			<Value>31.40</Value>
			<Value>32.00</Value>
			<Value>31.10</Value>
			<Value>36.88</Value>
			<Value>32.74</Value>
			<Value>33.53</Value>
			<Value>32.88</Value>
		</Entry>
		<Entry>
			<Value>CN</Value>
			<Value>10.30</Value>
			<Value>11.19</Value>
			<Value>12.27</Value>
			<Value>14.57</Value>
			<Value>16.64</Value>
			<Value>17.39</Value>
			<Value>19.06</Value>
		</Entry>
		<Entry>
			<Value>CZ</Value>
			<Value>18.74</Value>
			<Value>24.99</Value>
			<Value>24.10</Value>
			<Value>26.36</Value>
			<Value>19.99</Value>
			<Value>22.23</Value>
			<Value>21.59</Value>
		</Entry>
		<Entry>
			<Value>DE</Value>
			<Value>42.08</Value>
			<Value>61.43</Value>
			<Value>65.44</Value>
			<Value>62.51</Value>
			<Value>61.77</Value>
			<Value>54.13</Value>
			<Value>57.92</Value>
		</Entry>
		<Entry>
			<Value>DK</Value>
			<Value>7.75</Value>
			<Value>11.57</Value>
			<Value>13.70</Value>
			<Value>11.38</Value>
			<Value>11.36</Value>
			<Value>10.87</Value>
			<Value>11.73</Value>
		</Entry>
		<Entry>
			<Value>ES</Value>
			<Value>7.83</Value>
			<Value>11.56</Value>
			<Value>12.37</Value>
			<Value>14.52</Value>
			<Value>16.92</Value>
			<Value>14.86</Value>
			<Value>13.52</Value>
		</Entry>
		<Entry>
			<Value>FR</Value>
			<Value>73.17</Value>
			<Value>68.39</Value>
			<Value>71.86</Value>
			<Value>67.60</Value>
			<Value>58.74</Value>
			<Value>44.45</Value>
			<Value>66.60</Value>
		</Entry>
		<Entry>
			<Value>MZ</Value>
			<Value>5.77</Value>
			<Value>12.00</Value>
			<Value>12.83</Value>
			<Value>11.82</Value>
			<Value>11.21</Value>
			<Value>12.94</Value>
			<Value>13.00</Value>
		</Entry>
		<Entry>
			<Value>NL</Value>
			<Value>4.03</Value>
			<Value>5.40</Value>
			<Value>5.89</Value>
			<Value>5.57</Value>
			<Value>9.12</Value>
			<Value>10.56</Value>
			<Value>12.81</Value>
		</Entry>
		<Entry>
			<Value>PY</Value>
			<Value>47.36</Value>
			<Value>43.79</Value>
			<Value>45.71</Value>
			<Value>45.12</Value>
			<Value>46.30</Value>
			<Value>45.04</Value>
			<Value>43.38</Value>
		</Entry>
		<Entry>
			<Value>RU</Value>
			<Value>22.85</Value>
			<Value>22.52</Value>
			<Value>20.93</Value>
			<Value>18.47</Value>
			<Value>20.74</Value>
			<Value>17.92</Value>
			<Value>19.01</Value>
		</Entry>
		<Entry>
			<Value>SI</Value>
			<Value>5.55</Value>
			<Value>7.56</Value>
			<Value>7.02</Value>
			<Value>5.91</Value>
			<Value>7.82</Value>
			<Value>9.22</Value>
			<Value>10.14</Value>
		</Entry>
		<Entry>
			<Value>UA</Value>
			<Value>6.50</Value>
			<Value>10.07</Value>
			<Value>12.52</Value>
			<Value>12.55</Value>
			<Value>8.83</Value>
			<Value>7.96</Value>
			<Value>8.00</Value>
		</Entry>
		<Entry>
			<Value>US</Value>
			<Value>14.83</Value>
			<Value>19.79</Value>
			<Value>24.27</Value>
			<Value>20.14</Value>
			<Value>24.20</Value>
			<Value>18.14</Value>
			<Value>19.41</Value>
		</Entry>
		<Entry>
			<Value>UZ</Value>
			<Value>12.75</Value>
			<Value>11.50</Value>
			<Value>11.90</Value>
			<Value>11.44</Value>
			<Value>11.55</Value>
			<Value>11.50</Value>
			<Value>11.66</Value>
		</Entry>
		<Entry>
			<Value>ZA</Value>
			<Value>3.97</Value>
			<Value>13.42</Value>
			<Value>13.59</Value>
			<Value>14.50</Value>
			<Value>14.17</Value>
			<Value>14.05</Value>
			<Value>14.65</Value>
		</Entry>
	</Entries>
</Dataset>
