<?xml version="1.0" encoding="UTF-8"?>
<!-- 
This sample dataset holds the complete information needed to set-up a visualization for the BO's ENE project. 
Author: Benno Schmidt, Department of Geodesy, Bochum University of Applied Sciences.
-->
<Dataset version="0.1" xmlns:xsi="http://www.w3.org/2001/XMLSchema-instance" xsi:noNamespaceSchemaLocation="xsd/Dataset.xsd">
	<GeneralInformation>
		<Theme>
			<Title language="EN">World countries as shape (with simplified borders in a scale of 1:110m)</Title>
			<Title language="DE">Shape mit weltweiten Staatsgrenzen (Grenzen sind vereinfacht in einem Maßstab von 1:110m)</Title>
			<Description language="DE">
				Dieses Dokument verweist auf den Quelldatei mit den Geometrien der Staatsgrenzen weltweit 
				(ESRI-Shape-Format). 
				Pro Staat werden die de facto Staatsgrenzen in Form eines Multipolygons vorgehalten.
				In der Shape-Datei sind unter anderem Länderkürzel im ISO3166-ALPHA-2 - Format angegeben, so dass über die "CountryCodes_simplified_110m.xml"
				im ENE-Projekt eine Georeferenzierung länderbezogener statistischer Daten möglich wird.
			</Description>
		</Theme>
		<Unit />
		<PublicReference>Nathaniel Vaughn KELSO, Project Manager - http://www.naturalearthdata.com/</PublicReference>
		<MetadataReference>CountriesShape_simplified_110m_meta.xml</MetadataReference>
	</GeneralInformation>
	<TableStructure>
		<Property dataType="String">
			<Title>Shape file name</Title>
			<GeoReference featureType="ENE:EsriShape">
				<CRS>EPSG:4326</CRS>
			</GeoReference>
		</Property>
		<Property dataType="String">
			<Title>Database file name</Title>
		</Property>
		<Property dataType="String">
			<Title>Spatial extent</Title>
			<Description />
		</Property>
	</TableStructure>
	<Entries>
		<Entry>
			<Value>ne_110m_admin_0_countries.shp</Value>
			<Value>ne_110m_admin_0_countries.dbf</Value>
			<Value>-180,-90,180,90</Value>
		</Entry>
	</Entries>
</Dataset>
